{"checks":[{"id":"summary-output","message":"normal summary output","passed":true,"score":1},{"id":"filters-and-order","message":"prefix filtering and order","passed":true,"score":1},{"id":"input-errors","message":"input errors are useful","passed":true,"score":1}],"duration_ms":0,"finished_at":"2026-07-15T08:30:21.121447Z","schema_version":"0.2.0","started_at":"2026-07-15T08:30:21.028583Z","status":"ok","task_id":"python-text-report","task_version":"1.0.0"}